AGRO ID	AGRO label	AGRO definition	Agrovoc URI	Agrovoc label	
http://purl.obolibrary.org/obo/AGRO_00020003	bird guano	an animal manure composoed of the excrement of seabirds and bats.	http://aims.fao.org/aos/agrovoc/c_3414	guano	
http://purl.obolibrary.org/obo/AGRO_00000338	higher-level landform	The landform refers to the shape of the land surface in the area in which the agronomic trial site is located.	http://aims.fao.org/aos/agrovoc/c_34247ea4	landforms	
http://purl.obolibrary.org/obo/AGRO_00000015	conventional tillage process	A tillage process in which, approximately, less than 15 percent of the soil surface is covered by crop residue after planting.	http://aims.fao.org/aos/agrovoc/c_34250	conventional tillage	
http://purl.obolibrary.org/obo/AGRO_00000234	harvest implement	An implement that is used in an harvest process.	http://aims.fao.org/aos/agrovoc/c_3499	harvesters	
http://purl.obolibrary.org/obo/AGRO_00000224	land levelling implement	An implement that is used during a land levelling process.	http://aims.fao.org/aos/agrovoc/c_37266	land levelling equipment	
http://purl.obolibrary.org/obo/AGRO_00000006	irrigation process	A planned process in which water is artificially supplied to plant or soil to sustain plants. 	http://aims.fao.org/aos/agrovoc/c_3954	irrigation	
http://purl.obolibrary.org/obo/AGRO_00010015	number of irrigations	The occurrence of a irrigation process	http://aims.fao.org/aos/agrovoc/c_3956	RT irrigation scheduling	
http://purl.obolibrary.org/obo/AGRO_00000460	limbing process	A pruning process in which branches from either standing or downed trees are removed.	http://aims.fao.org/aos/agrovoc/c_4434	lopping	
http://purl.obolibrary.org/obo/AGRO_00002012	mist irrigation process	A localized irrigation process in which water is conveyed under high pressure through small nozzles and sprayed in a fine mist of water over the plants.	http://aims.fao.org/aos/agrovoc/c_4865	mist irrigation	
http://purl.obolibrary.org/obo/AGRO_00002029	mowing implement	An implement that is used in a mowing process.	http://aims.fao.org/aos/agrovoc/c_4963	mowers	
http://purl.obolibrary.org/obo/AGRO_00000111	mulching process	A planned process in which a layer of material is apply to the soil surface to conserve moisture, improve soil fertility, reduce pests population and enhance the visual appeal of the area.	http://aims.fao.org/aos/agrovoc/c_4978	mulching	
http://purl.obolibrary.org/obo/AGRO_00000476	long-term experiment	An agricultural experiment running over decadal time periods.	http://aims.fao.org/aos/agrovoc/c_4f8733aa	long term experiments	
http://purl.obolibrary.org/obo/AGRO_00000405	earth auger	Manually operated hand tool that consists of cutter head having semicircular blades connected to pipe with the help of clamp and flange. The connecting pipe is further connected to a handle.	http://aims.fao.org/aos/agrovoc/c_50115	augers	
http://purl.obolibrary.org/obo/AGRO_00000023	pest control process	A planned process in which unwanted organisms are controlled.	http://aims.fao.org/aos/agrovoc/c_5726	pest control	
http://purl.obolibrary.org/obo/AGRO_00000230	planting implement	An implement that is used in a planting process.	http://aims.fao.org/aos/agrovoc/c_5991	planting equipment	
http://purl.obolibrary.org/obo/AGRO_00000231	planting process	A planned process in which a plant reproductive material is set into the soil.	http://aims.fao.org/aos/agrovoc/c_5992	planting	
http://purl.obolibrary.org/obo/AGRO_00000027	pruning process	A planned process in which selected parts of the plant are removed. The practice entails targeted removal of diseased, damaged, dead, non-productive, structurally unsound, or otherwise unwanted tissue from plants. This is done in order to shape the plant or tree, improve plant or tree health, reduce the risk from falling branches, prepare nursery specimens for transplanting, and increase the yield or quality of harvested products.	http://aims.fao.org/aos/agrovoc/c_6274	pruning	
http://purl.obolibrary.org/obo/AGRO_00000469	crop rotation process	A planned process in which a definite cycle of crops or crop types is grown in succession on the same land.	http://aims.fao.org/aos/agrovoc/c_6662	crop rotation	
http://purl.obolibrary.org/obo/AGRO_00000039	side dressing	A band application in which the material entity is applied after seeding or planting.	http://aims.fao.org/aos/agrovoc/c_7055	sidedressing	
http://purl.obolibrary.org/obo/AGRO_00000142	seeding process	A planned process in which seeds are applied on or into the soil.	http://aims.fao.org/aos/agrovoc/c_7268	  allterm seeding	
http://purl.obolibrary.org/obo/AGRO_00000318	distance between rows	Average distance between plants in a same row.	http://aims.fao.org/aos/agrovoc/c_7272	spacing  alltterm row distance	
http://purl.obolibrary.org/obo/AGRO_00000316	distance between plants	Distance between two rows.	http://aims.fao.org/aos/agrovoc/c_7272	spacing  alltterm row distance, planting distance 	
http://purl.obolibrary.org/obo/AGRO_00000060	sprinkler irrigation process	An irrigation process in which water is distributed through a system of pipes, and is sprayed into the air through sprinklers so that it breaks up into small water drops which fall to the ground.	http://aims.fao.org/aos/agrovoc/c_7338	sprinkler irrigation	
http://purl.obolibrary.org/obo/AGRO_00000062	sub-irrigation process	An irrigation process in which water is delivered to the plant root zone from below the soil surface.	http://aims.fao.org/aos/agrovoc/c_7487	subsurface irrigation	
http://purl.obolibrary.org/obo/AGRO_00000454	threshing process	Planned process is which the edible part of the cereal grain is loosen from the scaly, inedible chaff that surrounds it. It is the step in grain preparation after harvesting and before winnowing, which separates the loosened chaff from the grain. Threshing does not remove the bran from the grain.	http://aims.fao.org/aos/agrovoc/c_7739	threshing	
http://purl.obolibrary.org/obo/AGRO_00000002	tillage process	A planned process in which soil is mechanicaly mixed, stirred or overturned.	http://aims.fao.org/aos/agrovoc/c_7771	tillage	
http://purl.obolibrary.org/obo/AGRO_00000300	field area	An area quality inhering in a field.	http://aims.fao.org/aos/agrovoc/c_77edfe55	field area	
http://purl.obolibrary.org/obo/AGRO_00000042	top dressing	A broadcast application in which a material entity is applied to an area after seedling emergence and establishment of plants.	http://aims.fao.org/aos/agrovoc/c_7813	topdressing	
http://purl.obolibrary.org/obo/AGRO_00000229	plant transplanting process	A planned process in which a plant is moved from one location to be planted in another one.	http://aims.fao.org/aos/agrovoc/c_7873	transplanting	
http://purl.obolibrary.org/obo/AGRO_00000056	drip irrigation process	A localized irrigation process in which water is conveyed under pressure through a pipe system where it drips slowly onto the soil close to the plants.	http://aims.fao.org/aos/agrovoc/c_7909	trickle irrigation  (alltterm drip irrigation)	
http://purl.obolibrary.org/obo/AGRO_00000464	baling process	An harvesting process in which dry forage is bound by ropes into a bale.	http://aims.fao.org/aos/agrovoc/c_795	baling	
http://purl.obolibrary.org/obo/AGRO_00000038	band application	An application method in which a material entity is applied in bands below, above, on one side, or on both sides of seeds or seedlings at planting.	http://aims.fao.org/aos/agrovoc/c_807	band placement	
http://purl.obolibrary.org/obo/AGRO_00000041	fertilizer basal application	A broadcast application in which fertilizer is applied to an area before planting or before seedling emergence.	http://aims.fao.org/aos/agrovoc/c_831	basal dressings	
http://purl.obolibrary.org/obo/AGRO_00000457	winnowing process	A planned process in which the grain is separated from chaff. It is also used to remove weevils or other pests from stored grain. It is done after threshing, the loosening of grain or seeds from the husks and straw.	http://aims.fao.org/aos/agrovoc/c_8409	winnowing	
http://purl.obolibrary.org/obo/AGRO_00000026	no-till	A planned process in which the soil is left undisturbed apart from where the seeds or planting material are placed.	http://aims.fao.org/aos/agrovoc/c_8511	zero tillage	
http://purl.obolibrary.org/obo/AGRO_00000330	strip plot design	An experimental design in which the desired precision for measuring the interaction effect between the two factors is higher than that for measuring the main effect of either one of  the two factors. This is accomplished with the use of three plot sizes : 	http://aims.fao.org/aos/agrovoc/c_9a431541	strip plot design	
http://purl.obolibrary.org/obo/AGRO_00000007	desuckering process	A pruning process in which one or more suckers are removed.	http://aims.fao.org/aos/agrovoc/c_a1d2d6f2	desuckering	
http://purl.obolibrary.org/obo/AGRO_00000394	tandem disc harrow	A disk harrow with disc blades arranged into four sections.	http://aims.fao.org/aos/agrovoc/c_b95256aa	tandem disc harrows	
http://purl.obolibrary.org/obo/AGRO_00000104	bark mulch	A mulch where the outer corky bark layer of timber trees, shredded or not, are used to cover soil surface.	http://aims.fao.org/aos/agrovoc/c_bc5f6400	bark mulches	
http://purl.obolibrary.org/obo/AGRO_00000336	square lattice design	A lattice design in which the number of treatment must be a perfect square. Blocks per replicate and plots per block are equal, and are the square root of the number of treatments.	http://aims.fao.org/aos/agrovoc/c_c10fe7cb	square lattice design	
http://purl.obolibrary.org/obo/AGRO_00000333	lattice design	An experimental design in which the blocks should be composed of plots that are as homogeneous as possible. Further, blocks in the same replication should be as near as possible to maximize the variation among replication. These incomplete blocks are combined into groups that form separate, complete replications.	http://aims.fao.org/aos/agrovoc/c_d0acd43f	lattice design	
http://purl.obolibrary.org/obo/AGRO_00000102	compost mulch	A mulch where compost is used to cover soil surface.	http://aims.fao.org/aos/agrovoc/c_d2c183d0	compost mulches	
http://purl.obolibrary.org/obo/AGRO_00000138	tine harrow	An implement consisting of a heavy framework having several spikes or tines, and dragged by an animal or a tractor.	http://aims.fao.org/aos/agrovoc/c_e7505488	tine harrows	
http://purl.obolibrary.org/obo/AGRO_00000337	alpha lattice design	A lattice design that is a resolvable incomplete block design where the number of treatments or block size does not meet the strict requirements for one of the lattice designs. Also the number of entries is a multiple of block size.	http://aims.fao.org/aos/agrovoc/c_ea23424c	alpha lattice design	